Question Number|Question|Choices|Correct Answer|Translation
39|"Από πόσα μέλη αποτελείται η Βουλή στην Κύπρο;"|"Α) 50 μέλη, Β) 80 μέλη, Γ) 100 μέλη, Δ) 150 μέλη"|1|"Сколько членов в парламенте на Кипре? Α) 50 членов, Β) 80 членов, Γ) 100 членов, Δ) 150 членов"
40|"Ποιος είναι ο χρόνος θητείας ενός μέλους της Βουλής στην Κύπρο;"|"Α) 5 έτη, Β) 4 έτη, Γ) 6 έτη, Δ) 8 έτη"|0|"Каков срок полномочий члена парламента на Кипре? Α) 5 лет, Β) 4 года, Γ) 6 лет, Δ) 8 лет"
41|"Η πρώτη γυναίκα πρόεδρος Βουλής από την ίδρυση της Κυπριακής Δημοκρατίας το 1960 είναι."|"Α) Αννίτα Δημητρίου, Β) Άννα Δημητρίου, Γ) Αννίτα Νικολάου, Δ) Άννα Νικολάου"|0|"Первой женщиной-председателем парламента с момента основания Кипрской Республики в 1960 году является: Α) Аннита Димитриу, Β) Анна Димитриу, Γ) Аннита Николау, Δ) Анна Николау"
42|"Ποια είναι η βασική αποστολή της Πυροσβεστικής Υπηρεσίας στην Κύπρο;"|"Α) Την πρόληψη και καταπολέμηση των πυρκαγιών, Β) Την επιβολή προστίμων σε παραβάτες του κανονισμού κατά της πυρπόλησης, Γ) Την αποκατάσταση των ζημιών που προκαλούνται από πυρκαγιές, Δ) Την παροχή ιατρικής βοήθειας σε θύματα πυρκαγιών"|0|"Какова основная миссия пожарной службы на Кипре? Α) Профилактика и тушение пожаров, Β) Наложение штрафов на нарушителей правил противопожарной безопасности, Γ) Восстановление ущерба, причиненного пожарами, Δ) Оказание медицинской помощи жертвам пожаров"
43|"Ποιος είναι ο ρόλος των οργανώσεων και των αρχών στην παροχή βοήθειας στους πρόσφυγες στην Κύπρο;"|"Α) Παρέχουν οικονομική ενίσχυση και υπηρεσίες υγείας, Β) Προωθούν την ένταξη στην κοινωνία και την εκπαίδευση, Γ) Παρέχουν νομική συμβουλή και προστασία, Δ) Όλα τα παραπάνω"|3|"Какова роль организаций и властей в оказании помощи беженцам на Кипре? Α) Оказание финансовой поддержки и медицинских услуг, Β) Содействие интеграции в общество и образование, Γ) Предоставление юридических консультаций и защиты, Δ) Все вышеперечисленное"
44|"Τι εννοούμε με τον όρο 'Νεκρή Ζώνη' στην Κύπρο;"|"Α) Μια περιοχή στην Κύπρο όπου η πρόσβαση είναι απαγορευμένη, Β) Μια περιοχή στην Κύπρο με χαμηλή πυκνότητα πληθυσμού, Γ) Μια περιοχή στην Κύπρο με έντονη βιοποικιλότητα, Δ) Μια περιοχή στην Κύπρο με εμπορικές δραστηριότητες"|0|"Что подразумевается под термином 'Мертвая зона' на Кипре? Α) Район на Кипре, где доступ запрещен, Β) Район на Кипре с низкой плотностью населения, Γ) Район на Кипре с высоким биоразнообразием, Δ) Район на Кипре с коммерческой деятельностью"
45|"Ποιος ελέγχει τη Νεκρή Ζώνη στην Κύπρο;"|"Α) Η Κυπριακή Κυβέρνηση, Β) Τα Ηνωμένα Έθνη, Γ) Η Τουρκική Στρατιωτική Δύναμη, Δ) Οι τοπικές αυτοδιοικήσεις στην Κύπρο"|1|"Кто контролирует Мертвую зону на Кипре? Α) Кипрское правительство, Β) Организация Объединенных Наций, Γ) Турецкие вооруженные силы, Δ) Местные органы самоуправления на Кипре"
46|"Πότε δημιουργήθηκε η Νεκρή Ζώνη στην Κύπρο;"|"Α) Το 1964, Β) Το 1974, Γ) Το 1983, Δ) Το 1995"|0|"Когда была создана Мертвая зона на Кипре? Α) В 1964 году, Β) В 1974 году, Γ) В 1983 году, Δ) В 1995 году"
47|"Ποιες είναι οι κύριες επιπτώσεις της Νεκρής Ζώνης στην Κύπρο;"|"Α) Οικονομικές προκλήσεις και περιορισμένη πρόσβαση στους πόρους, Β) Απομόνωση και διάσπαση της κοινότητας, Γ) Επιπτώσεις στο περιβάλλον και τη βιοποικιλότητα, Δ) Όλα τα παραπάνω"|1|"Каковы основные последствия Мертвой зоны на Кипре? Α) Экономические проблемы и ограниченный доступ к ресурсам, Β) Изоляция и разобщенность общины, Γ) Влияние на окружающую среду и биоразнообразие, Δ) Все вышеперечисленное"
48|"Με ποιες συμφωνίες η Κύπρος έγινε ανεξάρτητο κράτος;"|"Α) Ζυρίχης-Λονδίνου, Β) Βρυξελλών, Γ) Γενεύης"|0|"Какими соглашениями Кипр стал независимым государством? Α) Цюрих-Лондон, Β) Брюссель, Γ) Женева"
49|"Ποιος είναι ο σημερινός δήμαρχος της Λευκωσίας;"|"Α) Ανδρέας Βύρας, Β) Κωνσταντίνος Γιωρκάτζης, Γ) Χαράλαμπος Προύντζος, Δ) Φαίδωνας Φαίδονος"|2|"Кто является нынешним мэром Никосии? Α) Андреас Вирас, Β) Константинос Георкадзис, Γ) Хараламбос Прунтзос, Δ) Феодон Феодонис"
50|"Ποιος είναι ο σημερινός Αρχιεπίσκοπος της Κύπρου;"|"Α) Χρυσόστομος, Β) Γεώργιος, Γ) Μακάριος Γ'"|1|"Кто является нынешним архиепископом Кипра? Α) Хрисостом, Β) Георгий, Γ) Макариос III"
51|"Ποιος είναι ο τωρινός δήμαρχος της Λεμεσού;"|"Α) Φαίδωνας Φαίδωνος, Β) Γιάννης Αρμεύτης, Γ) Νίκος Νικολαΐδης"|1|"Кто является нынешним мэром Лимасола? Α) Феодон Феодонис, Β) Яннис Армеутис, Γ) Никос Николаидис"
52|"Πόσοι Κύπριοι εκπροσωπούν τη χώρα στο Ευρωπαικό Κοινοβούλιο;"|"Α) 2, Β) 4, Γ) 6"|2|"Сколько киприотов представляют страну в Европейском парламенте? Α) 2, Β) 4, Γ) 6"
