Question Number|Question|Choices|Correct Answer|Translation
1|"Ποιος είναι ο Αρχιεπίσκοπος της Κύπρου;"|"Α) Χρυσόστομος Β', Β) Μάκαριος Γ', Γ) Γεώργιος, Δ) Αναστάσιος"|2|"Кто является архиепископом Кипра? Α) Хрисостом II, Β) Макариос III, Γ) Георгий, Δ) Анастасий"
2|"Πότε απέκτησε η Κύπρος την ανεξαρτησία της;"|"Α) 1960, Β) 1974, Γ) 1981, Δ) 1998"|0|"Когда Кипр получил независимость? Α) 1960, Β) 1974, Γ) 1981, Δ) 1998"
3|"Ποιο είναι το συνήθες διάστημα μεταξύ των εκλογών για την εκλογή του προέδρου της Κύπρου;"|"Α) 4 χρόνια, Β) 5 χρόνια, Γ) 6 χρόνια, Δ) 7 χρόνια"|1|"Каков обычный интервал между выборами президента Кипра? Α) 4 года, Β) 5 лет, Γ) 6 лет, Δ) 7 лет"
4|"Πότε διεξήχθησαν οι πρώτες εκλογές για την εκλογή του προέδρου της Κύπρου;"|"Α) 1959, Β) 1974, Γ) 1981, Δ) 1998"|0|"Когда состоялись первые выборы президента Кипра? Α) 1959, Β) 1974, Γ) 1981, Δ) 1998"
5|"Ποιος εκλέγεται απευθείας από τον λαό στις εκλογές;"|"Α) Ο πρόεδρος, Β) Η Βουλή, Γ) Το υπουργικό συμβούλιο, Δ) Οι δικαστές"|0|"Кого выбирает народ на выборах? Α) Президента, Β) Парламент, Γ) Кабинет министров, Δ) Судей"
6|"Ποιος από τους παρακάτω οργανώνει τις εκλογές του προέδρου της Κύπρου;"|"Α) Κυβέρνηση της Κύπρου, Β) Κυπριακός Εκλογικός Σύνδεσμος, Γ) Κεντρική Υπηρεσία Εκλογών, Δ) Ευρωπαϊκή Ένωση"|2|"Кто из перечисленных организует выборы президента Кипра? Α) Правительство Кипра, Β) Кипрская избирательная комиссия, Γ) Центральное избирательное управление, Δ) Европейский Союз"
7|"Ποιος από τους παρακάτω έχει την εξουσία να διορίζει το υπουργικό συμβούλιο μετά τις εκλογές του προέδρου της Κύπρου;"|"Α) Ο πρόεδρος, Β) Το κοινοβούλιο, Γ) Το υπουργικό συμβούλιο, Δ) ο Δήμαρχος"|0|"Кто из перечисленных имеет власть назначать кабинет министров после выборов президента Кипра? Α) Президент, Β) Парламент, Γ) Кабинет министров, Δ) Мэр"
8|"Ποιοι πολίτες μπορούν να ψηφίσουν στις εκλογές του προέδρου της Κύπρου;"|"Α) Μόνο Κύπριοι πολίτες, Β) Μόνο πολίτες της Ευρωπαϊκής Ένωσης που διαμένουν στην Κύπρο, Γ) Κύπριοι πολίτες και πολίτες τρίτων χωρών που διαμένουν στην Κύπρο, Δ) Όλοι οι πολίτες που έχουν νόμιμη διαμονή στην Κύπρο"|0|"Кто может голосовать на выборах президента Кипра? Α) Только граждане Кипра, Β) Только граждане ЕС, проживающие на Кипре, Γ) Граждане Кипра и третьих стран, проживающие на Кипре, Δ) Все граждане с законным местом жительства на Кипре"
9|"Ποια είναι η ελάχιστη ηλικία για να ψηφίσει κάποιος στις εκλογές του προέδρου της Κύπρου;"|"Α) 16 ετών, Β) 18 ετών, Γ) 21 ετών, Δ) 25 ετών"|1|"Каков минимальный возраст для голосования на выборах президента Кипра? Α) 16 лет, Β) 18 лет, Γ) 21 год, Δ) 25 лет"
10|"Ποιοι πολίτες δεν μπορούν να ψηφίσουν στις εκλογές του προέδρου της Κύπρου;"|"Α) Οι πολίτες κάτω των 18 ετών, Β) Οι πολίτες με διπλή ιθαγένεια, Γ) Οι πολίτες που διαμένουν στην Κύπρο για λιγότερο από ένα έτος, Δ) Όλοι οι πολίτες μπορούν να ψηφίσουν"|0|"Кто не может голосовать на выборах президента Кипра? Α) Граждане младше 18 лет, Β) Граждане с двойным гражданством, Γ) Граждане, проживающие на Кипре менее одного года, Δ) Все граждане могут голосовать"
11|"Ποιοι πολίτες έχουν το δικαίωμα να ψηφίσουν στις εκλογές του προέδρου της Κύπρου αν έχουν εγκαταλείψει τη χώρα για εργασία ή σπουδές;"|"Α) Όλοι οι Κύπριοι πολίτες, Β) Μόνο οι πολίτες της Ευρωπαϊκής Ένωσης, Γ) Μόνο οι πολίτες που διαμένουν σε συγκεκριμένες χώρες, Δ) Κανένας πολίτης δεν έχει το δικαίωμα να ψηφίσει αν έχει εγκαταλείψει τη χώρα"|0|"Кто имеет право голосовать на выборах президента Кипра, если они уехали из страны для работы или учебы? Α) Все граждане Кипра, Β) Только граждане ЕС, Γ) Только граждане, проживающие в определенных странах, Δ) Никто не имеет права голосовать, если покинул страну"
12|"Ποια ήταν η ημερομηνία του πραξικοπήματος στην Κύπρο το 1974;"|"Α) 15 Ιουλίου 1974, Β) 20 Ιουλίου 1974, Γ) 25 Ιουλίου 1974, Δ) 30 Ιουλίου 1974"|1|"Какая дата переворота на Кипре в 1974 году? Α) 15 июля 1974 года, Β) 20 июля 1974 года, Γ) 25 июля 1974 года, Δ) 30 июля 1974 года"
13|"Ποια χώρα εμπλέκεται στο πραξικόπημα του 1974 στην Κύπρο;"|"Α) Ελλάδα, Β) Τουρκία, Γ) Ηνωμένο Βασίλειο, Δ) Ηνωμένες Πολιτείες"|0|"Какая страна была вовлечена в переворот на Кипре в 1974 году? Α) Греция, Β) Турция, Γ) Великобритания, Δ) Соединенные Штаты"
14|"Ποια είναι η κύρια αιτία που οδήγησε στο πραξικόπημα του 1974 στην Κύπρο;"|"Α) Εθνοτικές διαφορές μεταξύ Ελληνοκυπρίων και Τουρκοκυπρίων, Β) Οικονομική κρίση στην Κύπρο, Γ) Εξωτερικές πιέσεις από την Ευρωπαϊκή Ένωση, Δ) Συνθήκες αστάθειας στην περιοχή της Μεσογείου"|0|"Какова основная причина переворота на Кипре в 1974 году? Α) Этнические различия между греко-киприотами и турко-киприотами, Β) Экономический кризис на Кипре, Γ) Внешнее давление со стороны Европейского Союза, Δ) Условия нестабильности в районе Средиземного моря"
15|"Πότε εγκρίθηκε το Σύνταγμα της Κύπρου;"|"Α) Το 1960, Β) Το 1974, Γ) Το 1983, Δ) Το 1990"|0|"Когда была принята Конституция Кипра? Α) В 1960 году, Β) В 1974 году, Γ) В 1983 году, Δ) В 1990 году"
16|"Ποιο είναι το πολιτικό καθεστώς της Κύπρου σύμφωνα με το Σύνταγμα;"|"Α) Προεδρική δημοκρατία, Β) Παραλληλογραφή Δημοκρατία, Γ) Ομοσπονδιακή Δημοκρατία, Δ) Συνταγματική Μοναρχία"|0|"Каков политический строй Кипра согласно Конституции? Α) Президентская республика, Β) Параллельная республика, Γ) Федеративная республика, Δ) Конституционная монархия"
17|"Ποια είναι η επίσημη ονομασία των Ένοπλων Δυνάμεων της Κύπρου;"|"Α) Εθνική Φρουρά, Β) Εθνοφρουρία, Γ) Κυπριακή Αμυντική Δύναμη, Δ) Κυπριακή Φρουρά"|0|"Какое официальное название Вооруженных сил Кипра? Α) Национальная гвардия, Β) Этногвардия, Γ) Кипрские силы обороны, Δ) Кипрская гвардия"
18|"Ποιος είναι ο ρόλος του στρατού στην Κύπρο;"|"Α) Εσωτερική ασφάλεια και άμυνα της Κύπρου, Β) Διεθνής ειρήνη και ανθρωπιστική βοήθεια, Γ) Εξωτερικές επιχειρήσεις και καταπολέμηση της τρομοκρατίας, Δ) Πολιτικές αποστολές και προώθηση της διπλωματίας"|0|"Какова роль армии на Кипре? Α) Внутренняя безопасность и оборона Кипра, Β) Международный мир и гуманитарная помощь, Γ) Внешние операции и борьба с терроризмом, Δ) Политические миссии и продвижение дипломатии"
19|"Ποια είναι η ηλικία κατάταξης στην υποχρεωτική στρατιωτική θητεία στην Κύπρο;"|"Α) 18 ετών, Β) 19 ετών, Γ) 20 ετών, Δ) 21 ετών"|0|"Какой возраст призыва на обязательную военную службу на Кипре? Α) 18 лет, Β) 19 лет, Γ) 20 лет, Δ) 21 год"
20|"Ποιο είναι το κύριο έμβλημα του στρατού στην Κύπρο;"|"Α) Αετός, Β) Λεόνταυρος, Γ) Δελφίνι, Δ) Κρητικός ταύρος"|0|"Каков главный символ армии на Кипре? Α) Орел, Β) Леонтавр, Γ) Дельфин, Δ) Критский бык"
21|"Ποιο είναι το πλήρες ακρωνύμιο της ΕΟΚΑ;"|"Α) Εθνική Οργάνωση Κυπρίων Αγωνιστών, Β) Εθνική Ομάδα Κυπρίων Ανταρτών, Γ) Εθνική Οργάνωση Κυπριακής Ανεξαρτησίας, Δ) Εθνική Ομοσπονδία Κυπριακών Αθλητικών"|0|"Что означает аббревиатура ЕОКА? Α) Национальная организация кипрских борцов, Β) Национальная группа кипрских повстанцев, Γ) Национальная организация кипрской независимости, Δ) Национальная федерация кипрских спортивных ассоциаций"
22|"Πότε ιδρύθηκε η ΕΟΚΑ;"|"Α) Το 1955, Β) Το 1960, Γ) Το 1974, Δ) Το 1980"|0|"Когда была основана ЕОКА? Α) В 1955 году, Β) В 1960 году, Γ) В 1974 году, Δ) В 1980 году"
23|"Πότε ολοκληρώθηκε ο αγώνας της ΕΟΚΑ;"|"Α) Το 1959, Β) Το 1960, Γ) Το 1974, Δ) Το 1980"|0|"Когда завершилась борьба ЕОКА? Α) В 1959 году, Β) В 1960 году, Γ) В 1974 году, Δ) В 1980 году"
24|"Τι ακριβώς αναπαριστά το ακρωνύμιο ΚΕΠ;"|"Α) Κέντρο Ευημερίας Πολιτών, Β) Κέντρο Εκπαίδευσης Πολιτών, Γ) Κέντρο Επικοινωνίας Πολιτών, Δ) Κέντρο Εξυπηρέτησης Πολιτών"|3|"Что означает аббревиатура КЕП? Α) Центр благосостояния граждан, Β) Центр обучения граждан, Γ) Центр связи с гражданами, Δ) Центр обслуживания граждан"
25|"Ποιος οργανισμός είναι υπεύθυνος για τη λειτουργία των ΚΕΠ στην Κύπρο;"|"Α) Υπουργείο Εσωτερικών, Β) Υπουργείο Οικονομικών, Γ) Υπουργείο Υγείας, Δ) Υπουργείο Εργασίας"|1|"Какое учреждение отвечает за работу КЕП на Кипре? Α) Министерство внутренних дел, Β) Министерство финансов, Γ) Министерство здравоохранения, Δ) Министерство труда"
26|"Πού μπορεί κάποιος να βρει τα ΚΕΠ στην Κύπρο;"|"Α) Σε όλες τις μεγάλες πόλεις και χωριά της Κύπρου, Β) Μόνο στην πρωτεύουσα, Λευκωσία, Γ) Μόνο σε επιλεγμένες περιοχές της Κύπρου, Δ) Μόνο σε αστικές περιοχές της Κύπρου"|0|"Где можно найти КЕП на Кипре? Α) Во всех крупных городах и деревнях Кипра, Β) Только в столице, Никосии, Γ) Только в отдельных районах Кипра, Δ) Только в городских районах Кипра"
27|"Ποια είναι η λειτουργία της ΓΕΣΥ στην Κύπρο;"|"Α) Υπεύθυνη για τη διαχείριση των στρατιωτικών εγκαταστάσεων στην Κύπρο, Β) Υπεύθυνη για την παροχή υπηρεσιών υγείας στους πολίτες της Κύπρου, Γ) Υπεύθυνη για την οργάνωση και την προαγωγή του αθλητισμού στην Κύπρο, Δ) Υπεύθυνη για τη διαχείριση των κοινοτικών υπηρεσιών στην Κύπρο"|1|"Какова функция ГЕСИ на Кипре? Α) Ответственна за управление военными объектами на Кипре, Β) Ответственна за оказание медицинских услуг гражданам Кипра, Γ) Ответственна за организацию и продвижение спорта на Кипре, Δ) Ответственна за управление коммунальными услугами на Кипре"
28|"Ποιο υπουργείο είναι υπεύθυνο για την ΓΕΣΥ στην Κύπρο;"|"Α) Υπουργείο Εσωτερικών, Β) Υπουργείο Οικονομικών, Γ) Υπουργείο Εργασίας και Κοινωνικών Ασφαλίσεων, Δ) Υπουργείο Υγείας"|3|"Какое министерство отвечает за ГЕСИ на Кипре? Α) Министерство внутренних дел, Β) Министерство финансов, Γ) Министерство труда и социального обеспечения, Δ) Министерство здравоохранения"
29|"Ποιες υπηρεσίες παρέχονται από τη ΓΕΣΥ στην Κύπρο;"|"Α) Παροχή ιατρικών εξετάσεων και περίθαλψης, Β) Παροχή κοινωνικών παροχών και επιδομάτων, Γ) Παροχή εκπαιδευτικών υπηρεσιών και σεμιναρίων, Δ) Παροχή δημόσιων συγκοινωνιακών υπηρεσιών"|0|"Какие услуги предоставляет ГЕСИ на Кипре? Α) Проведение медицинских осмотров и лечение, Β) Предоставление социальных пособий и льгот, Γ) Предоставление образовательных услуг и семинаров, Δ) Предоставление услуг общественного транспорта"
30|"Πού μπορούν οι πολίτες να λάβουν πληροφορίες σχετικά με τη ΓΕΣΥ στην Κύπρο;"|"Α) Σε ιδιωτικά κέντρα υγείας, Β) Σε νοσοκομεία και κέντρα υγείας της κυβέρνησης, Γ) Στις τοπικές αυτοδιοικήσεις, Δ) Στον επίσημο ιστότοπο της ΓΕΣΥ"|3|"Где граждане могут получить информацию о ГЕСИ на Кипре? Α) В частных медицинских центрах, Β) В государственных больницах и медицинских центрах, Γ) В местных органах самоуправления, Δ) На официальном сайте ГЕСИ"
31|"Ποιος είναι ο ρόλος της Αστυνομίας στην Κύπρο;"|"Α) Προώθηση του πολιτισμού και της εκπαίδευσης, Β) Παροχή υπηρεσιών υγείας και φροντίδας των πολιτών, Γ) Διασφάλιση της δημόσιας τάξης, της ασφάλειας και της εφαρμογής του νόμου, Δ) Προώθηση του τουρισμού και της ανάπτυξης του εμπορίου"|2|"Какова роль полиции на Кипре? Α) Продвижение культуры и образования, Β) Оказание медицинских услуг и забота о гражданах, Γ) Обеспечение общественного порядка, безопасности и соблюдения закона, Δ) Продвижение туризма и развитие торговли"
32|"Πού μπορούν οι πολίτες να απευθυνθούν για να αναφέρουν ένα περιστατικό ή να ζητήσουν βοήθεια από την Αστυνομία;"|"Α) Σε καταστήματα κοινότητας, Β) Σε ιατρεία και νοσοκομεία, Γ) Σε αστυνομικά τμήματα και κεντρικό αστυνομικό σταθμό, Δ) Στο υπουργείο αστυνομίας"|2|"Куда граждане могут обратиться для сообщения о происшествии или получения помощи от полиции? Α) В общественные центры, Β) В клиники и больницы, Γ) В полицейские участки и центральное полицейское управление, Δ) В министерство полиции"
33|"Τι είναι η ΑΗΚ;"|"Α) Ο φορέας παραγωγής και διανομής ηλεκτρικής ενέργειας στην Κύπρο, Β) Μια μη κυβερνητική οργάνωση που προωθεί την αειφορία και την προστασία του περιβάλλοντος, Γ) Ένας κοινωνικός φορέας που παρέχει υπηρεσίες κοινωνικής πρόνοιας, Δ) Ένας αθλητικός σύλλογος που προάγει την άθληση και την υγεία"|0|"Что такое АИК? Α) Организация по производству и распределению электроэнергии на Кипре, Β) Некоммерческая организация, продвигающая устойчивое развитие и охрану окружающей среды, Γ) Социальная организация, предоставляющая услуги социального обеспечения, Δ) Спортивный клуб, продвигающий спорт и здоровье"
34|"Ποιες είναι οι βασικές αρμοδιότητες της ΑΗΚ;"|"Α) Παραγωγή, διανομή και πώληση ηλεκτρικής ενέργειας στην Κύπρο, Β) Παροχή ιατροφαρμακευτικών υπηρεσιών στους πολίτες, Γ) Παροχή εκπαιδευτικών υπηρεσιών σε φοιτητές και εργαζόμενους, Δ) Οργάνωση αθλητικών εκδηλώσεων και αγώνων"|0|"Каковы основные обязанности АИК? Α) Производство, распределение и продажа электроэнергии на Кипре, Β) Предоставление медицинских и фармацевтических услуг гражданам, Γ) Предоставление образовательных услуг студентам и работникам, Δ) Организация спортивных мероприятий и соревнований"
35|"Πού μπορούν οι κάτοικοι της Κύπρου να απευθυνθούν για να λύσουν θέματα ηλεκτροδότησης ή να υποβάλουν προβλήματα στην ΑΗΚ;"|"Α) Σε τοπικά καταστήματα ψιλικών και μίνι μάρκετ, Β) Στο υπουργείο ενέργειας και υδροκαρβυκών, Γ) Στα επαρχιακά γραφεία της ΑΗΚ, Δ) Στο κοινοβούλιο της Κύπρου"|2|"Куда могут обратиться жители Кипра для решения вопросов электроснабжения или подачи жалоб в АИК? Α) В местные магазины и мини-маркеты, Β) В министерство энергетики и углеводородов, Γ) В районные офисы АИК, Δ) В парламент Кипра"
36|"Ποιες είναι οι βασικές υπηρεσίες που προσφέρει το Ταχυδρομείο στην Κύπρο;"|"Α) Παράδοση γραμμάτων και δέματων, Β) Παροχή τηλεπικοινωνιακών υπηρεσιών, Γ) Παροχή υπηρεσιών ταχυδρομικής τραπεζικής, Δ) Παροχή υπηρεσιών κοινωνικής πρόνοιας"|0|"Каковы основные услуги, предоставляемые Почтой Кипра? Α) Доставка писем и посылок, Β) Предоставление телекоммуникационных услуг, Γ) Предоставление почтовых банковских услуг, Δ) Предоставление услуг социального обеспечения"
37|"Ποια είναι η κανονική διαδικασία παραλαβής ενός πακέτου από το Ταχυδρομείο;"|"Α) Προσέλευση στο τοπικό γραφείο του Ταχυδρομείου με την επίδειξη ταυτότητας, Β) Προσέλευση στον κεντρικό χώρο ταχυδρομικής διανομής της πόλης, Γ) Παραλαβή του πακέτου από τον υπάλληλο της εταιρείας μεταφορών, Δ) Παράδοση του πακέτου στον παραλήπτη μέσω ασφαλούς αποστολής"|0|"Каков стандартный процесс получения посылки на Почте? Α) Посещение местного почтового отделения с удостоверением личности, Β) Посещение центрального почтового распределительного пункта города, Γ) Получение посылки от сотрудника транспортной компании, Δ) Доставка посылки получателю через безопасную отправку"
38|"Ποιος είναι ο ρόλος της Βουλής στην Κύπρο;"|"Α) Να ασκεί τη νομοθετική εξουσία της χώρας, Β) Να διορίζει τον Πρόεδρο της Κύπρου, Γ) Να διαχειρίζεται τον εκτελεστικό κλάδο της κυβέρνησης, Δ) Να εποπτεύει τη δράση των στρατιωτικών δυνάμεων στην Κύπρο"|0|"Какова роль парламента на Кипре? Α) Осуществление законодательной власти в стране, Β) Назначение президента Кипра, Γ) Управление исполнительной ветвью власти, Δ) Контроль за действиями вооруженных сил на Кипре"
